{
  "command": [
    "scripts/run_v9_human_organoid_sensitivity.py"
  ],
  "generated_at": "2026-05-22T01:01:50.708221+00:00",
  "input_files": [
    {
      "path": "v9/human_organoid/reports/sensitivity/tvg5000_none_none/draft_human_organoid_spaceflight/predictions.csv",
      "role": "submission",
      "sha256": "b0dda6d4fb6e355d4d36ff6d363cb64dcb76a88c7151b8d4ef89be19f1ab6951"
    },
    {
      "path": "v9/human_organoid/task_manifests/draft_human_organoid_spaceflight.json",
      "role": "task_manifest",
      "sha256": "18d2cfad88dd5347c90426ee4aa31db65dce6e08a3fa32a609d49b273618d557"
    }
  ],
  "metrics": {
    "auroc": {
      "status": "computed",
      "value": 0.6625
    },
    "balanced_accuracy": {
      "status": "computed",
      "value": 0.6806818181818182
    },
    "calibration_error": {
      "status": "computed",
      "value": 0.15264543301666667
    },
    "macro_f1": {
      "status": "computed",
      "value": 0.6785258681785967
    },
    "mission_discrimination": {
      "reason": "embedding_* columns missing",
      "status": "skipped"
    }
  },
  "run_type": "spacebio_bench_evaluation",
  "schema_version": "0.1.0",
  "spacebio_bench_version": "0.1.0-alpha",
  "status": "evaluated",
  "task_family": "human_organoid_spaceflight",
  "task_id": "draft_human_organoid_spaceflight",
  "validation": {
    "columns": [
      "task_id",
      "fold_id",
      "sample_id",
      "mission",
      "true_label",
      "predicted_label",
      "flight_probability"
    ],
    "embedding_columns": [],
    "errors": [],
    "extra_columns": [],
    "n_rows": 84,
    "ok": true,
    "submission_path": "v9/human_organoid/reports/sensitivity/tvg5000_none_none/draft_human_organoid_spaceflight/predictions.csv",
    "task_id": "draft_human_organoid_spaceflight",
    "warnings": []
  }
}
