{
  "command": [
    "scripts/run_v9_osd120_interaction_sensitivity.py"
  ],
  "generated_at": "2026-05-23T15:00:44.575259+00:00",
  "input_files": [
    {
      "path": "v9/multispecies/reports/interaction_sensitivity/tvg5000_log1p_zscore/secondary_light_treatment_holdout/draft_osd120_arabidopsis_root_light_interaction_spaceflight/predictions.csv",
      "role": "submission",
      "sha256": "8d6c7db972e935b38b75ad458b5f917f8b398c14acba71f10e9d71e9c5d757b1"
    },
    {
      "path": "v9/multispecies/interaction_task_manifests/draft_osd120_arabidopsis_root_light_interaction_spaceflight.json",
      "role": "task_manifest",
      "sha256": "4f61d0dc755d634b5a5b0b47c67841e9e4de5b7c6e17bbe051293533430860b5"
    }
  ],
  "metrics": {
    "auroc": {
      "status": "computed",
      "value": 0.7746913580246914
    },
    "balanced_accuracy": {
      "status": "computed",
      "value": 0.6388888888888888
    },
    "calibration_error": {
      "status": "computed",
      "value": 0.11439641802500003
    },
    "condition_stratum_holdout_delta": {
      "reason": "not applicable to fold_family=secondary_light_treatment_holdout",
      "status": "skipped"
    },
    "genotype_holdout_delta": {
      "reason": "not applicable to fold_family=secondary_light_treatment_holdout",
      "status": "skipped"
    },
    "light_treatment_holdout_delta": {
      "details": {
        "holdout_light_treatment_dark_treatment": {
          "balanced_accuracy": 0.7222222222222222,
          "heldout_value": "Dark.Treatment",
          "n_test": 18
        },
        "holdout_light_treatment_light_treatment": {
          "balanced_accuracy": 0.5555555555555556,
          "heldout_value": "Light.Treatment",
          "n_test": 18
        }
      },
      "interpretation": "range of fold-level balanced_accuracy across secondary_light_treatment_holdout folds",
      "status": "computed",
      "value": 0.16666666666666663
    },
    "macro_f1": {
      "status": "computed",
      "value": 0.6363636363636364
    },
    "mission_discrimination": {
      "reason": "mission_discrimination requires at least two missions",
      "status": "skipped"
    }
  },
  "run_type": "spacebio_bench_evaluation",
  "schema_version": "0.1.0",
  "spacebio_bench_version": "0.1.0-alpha",
  "status": "evaluated",
  "task_family": "multispecies_light_interaction_spaceflight",
  "task_id": "draft_osd120_arabidopsis_root_light_interaction_spaceflight",
  "validation": {
    "columns": [
      "task_id",
      "fold_id",
      "sample_id",
      "mission",
      "condition_stratum",
      "genotype_or_ecotype",
      "light_treatment",
      "true_label",
      "predicted_label",
      "flight_probability",
      "embedding_0",
      "embedding_1"
    ],
    "embedding_columns": [
      "embedding_0",
      "embedding_1"
    ],
    "errors": [],
    "extra_columns": [],
    "n_rows": 36,
    "ok": true,
    "submission_path": "v9/multispecies/reports/interaction_sensitivity/tvg5000_log1p_zscore/secondary_light_treatment_holdout/draft_osd120_arabidopsis_root_light_interaction_spaceflight/predictions.csv",
    "task_id": "draft_osd120_arabidopsis_root_light_interaction_spaceflight",
    "warnings": []
  }
}
