{
  "command": [
    "scripts/run_v9_osd120_interaction_sensitivity.py"
  ],
  "generated_at": "2026-05-23T15:00:50.472837+00:00",
  "input_files": [
    {
      "path": "v9/multispecies/reports/interaction_sensitivity/tvg5000_none_zscore/primary_genotype_or_ecotype_holdout/draft_osd120_arabidopsis_root_light_interaction_spaceflight/predictions.csv",
      "role": "submission",
      "sha256": "2d9d51f6f6766a65b4c957b356efefae99665fa75556f9d38064073a04bb689b"
    },
    {
      "path": "v9/multispecies/interaction_task_manifests/draft_osd120_arabidopsis_root_light_interaction_spaceflight.json",
      "role": "task_manifest",
      "sha256": "4f61d0dc755d634b5a5b0b47c67841e9e4de5b7c6e17bbe051293533430860b5"
    }
  ],
  "metrics": {
    "auroc": {
      "status": "computed",
      "value": 0.6666666666666666
    },
    "balanced_accuracy": {
      "status": "computed",
      "value": 0.6111111111111112
    },
    "calibration_error": {
      "status": "computed",
      "value": 0.08947939997222223
    },
    "condition_stratum_holdout_delta": {
      "reason": "not applicable to fold_family=primary_genotype_or_ecotype_holdout",
      "status": "skipped"
    },
    "genotype_holdout_delta": {
      "details": {
        "holdout_genotype_or_ecotype_col_0": {
          "balanced_accuracy": 0.6666666666666666,
          "heldout_value": "Col.0",
          "n_test": 12
        },
        "holdout_genotype_or_ecotype_col_0_phyd": {
          "balanced_accuracy": 0.5833333333333333,
          "heldout_value": "Col.0.PhyD",
          "n_test": 12
        },
        "holdout_genotype_or_ecotype_wassilewskija_ecotype": {
          "balanced_accuracy": 0.5833333333333334,
          "heldout_value": "Wassilewskija.ecotype",
          "n_test": 12
        }
      },
      "interpretation": "range of fold-level balanced_accuracy across primary_genotype_or_ecotype_holdout folds",
      "status": "computed",
      "value": 0.08333333333333337
    },
    "light_treatment_holdout_delta": {
      "reason": "not applicable to fold_family=primary_genotype_or_ecotype_holdout",
      "status": "skipped"
    },
    "macro_f1": {
      "status": "computed",
      "value": 0.60625
    },
    "mission_discrimination": {
      "reason": "mission_discrimination requires at least two missions",
      "status": "skipped"
    }
  },
  "run_type": "spacebio_bench_evaluation",
  "schema_version": "0.1.0",
  "spacebio_bench_version": "0.1.0-alpha",
  "status": "evaluated",
  "task_family": "multispecies_light_interaction_spaceflight",
  "task_id": "draft_osd120_arabidopsis_root_light_interaction_spaceflight",
  "validation": {
    "columns": [
      "task_id",
      "fold_id",
      "sample_id",
      "mission",
      "condition_stratum",
      "genotype_or_ecotype",
      "light_treatment",
      "true_label",
      "predicted_label",
      "flight_probability",
      "embedding_0",
      "embedding_1"
    ],
    "embedding_columns": [
      "embedding_0",
      "embedding_1"
    ],
    "errors": [],
    "extra_columns": [],
    "n_rows": 36,
    "ok": true,
    "submission_path": "v9/multispecies/reports/interaction_sensitivity/tvg5000_none_zscore/primary_genotype_or_ecotype_holdout/draft_osd120_arabidopsis_root_light_interaction_spaceflight/predictions.csv",
    "task_id": "draft_osd120_arabidopsis_root_light_interaction_spaceflight",
    "warnings": []
  }
}
