{
  "command": [
    "scripts/run_v9_osd120_interaction_logistic_sensitivity.py",
    "--repo-root",
    "/Users/jak4013/Dropbox/Bioinformatics/Claude/GeneLab_benchmark"
  ],
  "generated_at": "2026-05-25T15:56:20.082545+00:00",
  "input_files": [
    {
      "path": "v9/multispecies/reports/interaction_logistic_l2_sensitivity/tvg500_log1p_zscore_c0p1/secondary_light_treatment_holdout/draft_osd120_arabidopsis_root_light_interaction_spaceflight/predictions.csv",
      "role": "submission",
      "sha256": "d5fd636d2d9c8b47671b087c428950b8554ef98bbd5a42c7ba2b841b9f965451"
    },
    {
      "path": "/Users/jak4013/Dropbox/Bioinformatics/Claude/GeneLab_benchmark/v9/multispecies/interaction_task_manifests/draft_osd120_arabidopsis_root_light_interaction_spaceflight.json",
      "role": "task_manifest",
      "sha256": "4f61d0dc755d634b5a5b0b47c67841e9e4de5b7c6e17bbe051293533430860b5"
    }
  ],
  "metrics": {
    "auroc": {
      "status": "computed",
      "value": 0.8518518518518519
    },
    "balanced_accuracy": {
      "status": "computed",
      "value": 0.6666666666666667
    },
    "calibration_error": {
      "status": "computed",
      "value": 0.21091703674111115
    },
    "condition_stratum_holdout_delta": {
      "reason": "not applicable to fold_family=secondary_light_treatment_holdout",
      "status": "skipped"
    },
    "genotype_holdout_delta": {
      "reason": "not applicable to fold_family=secondary_light_treatment_holdout",
      "status": "skipped"
    },
    "light_treatment_holdout_delta": {
      "details": {
        "holdout_light_treatment_dark_treatment": {
          "balanced_accuracy": 0.8333333333333333,
          "heldout_value": "Dark.Treatment",
          "n_test": 18
        },
        "holdout_light_treatment_light_treatment": {
          "balanced_accuracy": 0.5,
          "heldout_value": "Light.Treatment",
          "n_test": 18
        }
      },
      "interpretation": "range of fold-level balanced_accuracy across secondary_light_treatment_holdout folds",
      "status": "computed",
      "value": 0.33333333333333326
    },
    "macro_f1": {
      "status": "computed",
      "value": 0.6571428571428571
    },
    "mission_discrimination": {
      "reason": "embedding_* columns missing",
      "status": "skipped"
    }
  },
  "run_type": "spacebio_bench_evaluation",
  "schema_version": "0.1.0",
  "spacebio_bench_version": "0.1.0-alpha",
  "status": "evaluated",
  "task_family": "multispecies_light_interaction_spaceflight",
  "task_id": "draft_osd120_arabidopsis_root_light_interaction_spaceflight",
  "validation": {
    "columns": [
      "task_id",
      "fold_id",
      "sample_id",
      "mission",
      "condition_stratum",
      "genotype_or_ecotype",
      "light_treatment",
      "true_label",
      "predicted_label",
      "flight_probability"
    ],
    "embedding_columns": [],
    "errors": [],
    "extra_columns": [],
    "n_rows": 36,
    "ok": true,
    "submission_path": "v9/multispecies/reports/interaction_logistic_l2_sensitivity/tvg500_log1p_zscore_c0p1/secondary_light_treatment_holdout/draft_osd120_arabidopsis_root_light_interaction_spaceflight/predictions.csv",
    "task_id": "draft_osd120_arabidopsis_root_light_interaction_spaceflight",
    "warnings": []
  }
}
