{
  "command": [
    "scripts/run_v9_multispecies_sensitivity.py"
  ],
  "generated_at": "2026-05-23T04:23:57.666813+00:00",
  "input_files": [
    {
      "path": "v9/multispecies/reports/sensitivity/tvg100_none_none/draft_osd207_drosophila_whole_body_spaceflight/predictions.csv",
      "role": "submission",
      "sha256": "e049810cb381be452ac9e0713d56f0e0dd69f220c805a32519cd4071c9886d77"
    },
    {
      "path": "v9/multispecies/task_manifests/draft_osd207_drosophila_whole_body_spaceflight.json",
      "role": "task_manifest",
      "sha256": "657e900f423374d3481f1d8034a2a2a21ff75de5b5050c8b6f07d726475f8f6f"
    }
  ],
  "metrics": {
    "auroc": {
      "status": "computed",
      "value": 0.95703125
    },
    "balanced_accuracy": {
      "status": "computed",
      "value": 0.9375
    },
    "calibration_error": {
      "status": "computed",
      "value": 0.29279011185937504
    },
    "condition_stratum_holdout_delta": {
      "details": {
        "holdout_condition_stratum_canton_s_sei_ts1": {
          "balanced_accuracy": 1.0,
          "heldout_value": "Canton.S_Sei.ts1",
          "n_test": 8
        },
        "holdout_condition_stratum_canton_s_wild_type": {
          "balanced_accuracy": 1.0,
          "heldout_value": "Canton.S_Wild.Type",
          "n_test": 8
        },
        "holdout_condition_stratum_w1118_kcnq370": {
          "balanced_accuracy": 0.875,
          "heldout_value": "w1118_KCNQ370",
          "n_test": 8
        },
        "holdout_condition_stratum_w1118_wild_type": {
          "balanced_accuracy": 0.875,
          "heldout_value": "w1118_Wild.Type",
          "n_test": 8
        }
      },
      "interpretation": "range of fold-level balanced_accuracy across held-out condition strata",
      "status": "computed",
      "value": 0.125
    },
    "macro_f1": {
      "status": "computed",
      "value": 0.9372549019607843
    },
    "mission_discrimination": {
      "reason": "mission_discrimination requires at least two missions",
      "status": "skipped"
    }
  },
  "run_type": "spacebio_bench_evaluation",
  "schema_version": "0.1.0",
  "spacebio_bench_version": "0.1.0-alpha",
  "status": "evaluated",
  "task_family": "multispecies_species_native_spaceflight",
  "task_id": "draft_osd207_drosophila_whole_body_spaceflight",
  "validation": {
    "columns": [
      "task_id",
      "fold_id",
      "sample_id",
      "mission",
      "condition_stratum",
      "true_label",
      "predicted_label",
      "flight_probability",
      "embedding_0",
      "embedding_1"
    ],
    "embedding_columns": [
      "embedding_0",
      "embedding_1"
    ],
    "errors": [],
    "extra_columns": [],
    "n_rows": 32,
    "ok": true,
    "submission_path": "v9/multispecies/reports/sensitivity/tvg100_none_none/draft_osd207_drosophila_whole_body_spaceflight/predictions.csv",
    "task_id": "draft_osd207_drosophila_whole_body_spaceflight",
    "warnings": []
  }
}
