{
  "command": [
    "scripts/run_v9_sklearn_baselines.py",
    "--output-dir",
    "v9/reports/sklearn_baselines"
  ],
  "generated_at": "2026-05-21T06:08:27.735750+00:00",
  "input_files": [
    {
      "path": "v9/reports/sklearn_baselines/logistic_regression_l2/A6_eye_bulk_lomo/predictions.csv",
      "role": "submission",
      "sha256": "a4aa366ee2e9cf45470c5c045c65c305ed5ff6f16795f4876595e09c692815c1"
    },
    {
      "path": "v9/task_manifests/A6_eye_bulk_lomo.json",
      "role": "task_manifest",
      "sha256": "e77b72bbc38ed111640e15a32fbb154b1620378be79d7c0008f48bd995a11a0d"
    }
  ],
  "metrics": {
    "auroc": {
      "status": "computed",
      "value": 0.711764705882353
    },
    "balanced_accuracy": {
      "status": "computed",
      "value": 0.5220588235294118
    },
    "calibration_error": {
      "status": "computed",
      "value": 0.3985540830010541
    },
    "macro_f1": {
      "status": "computed",
      "value": 0.504334121355398
    },
    "mission_discrimination": {
      "reason": "embedding_* columns missing",
      "status": "skipped"
    }
  },
  "run_type": "spacebio_bench_evaluation",
  "schema_version": "0.1.0",
  "spacebio_bench_version": "0.1.0-alpha",
  "status": "evaluated",
  "task_family": "bulk_lomo",
  "task_id": "A6_eye_bulk_lomo",
  "validation": {
    "columns": [
      "task_id",
      "fold_id",
      "sample_id",
      "mission",
      "true_label",
      "predicted_label",
      "flight_probability"
    ],
    "embedding_columns": [],
    "errors": [],
    "extra_columns": [],
    "n_rows": 37,
    "ok": true,
    "submission_path": "v9/reports/sklearn_baselines/logistic_regression_l2/A6_eye_bulk_lomo/predictions.csv",
    "task_id": "A6_eye_bulk_lomo",
    "warnings": []
  }
}
